Tag,Content
Intro1,Zvonek zvoní a zbývající studentky vcházejí do třídy.
Intro2A,"Každá si sedá na své místo, některé ti mávají, některé tě ignorují."
Intro2B,"Všechny jsou překvapené, když vidí Amandu jen v prádle a svázanou."
Intro2C,"Všechny jsou překvapené, když vidí Sidney jen v prádle a svázanou."
Intro2D,"Všechny jsou překvapené, když vidí obě dívky jen v prádle a svázané.",
Intro3A,Přichází učitelka a první ranní předmět začíná.
Intro3B,"Některé studentky se odvracejí, některé se smějí a scénu si fotí."
Intro4,Učitelka konečně přichází a snaží se uklidnit situaci.
Intro5,"Jelikož za to můžeš ty a Sidniny provazy, půjdete obě se mnou."
