NPCWedding0,You leave the club with your lover and head to your wedding venue.
NPCWedding1,You both dress up in wedding dresses and exchange a long embrace.
NPCWedding2,The bridesmaids meet you there and celebrate your new matrimony.
NPCWedding3,"You both vow to love, cherish, and take care of each other forever."
NPCWedding4,You exchange wedding rings and a long and wonderful French kiss.
NPCWedding5,"With cheers and applauses, you're officially declared wife and wife."
NPCWedding6,"The wedding party starts, and everyone seems to have a good time."
NPCWedding7,It doesn't take very long until the bridesmaids get in tight bondage.
NPCWedding8,Friends and members from the Bondage Club congratulate you both.
NPCWedding9,"Later, you go to a bondage dungeon to celebrate your honeymoon."
NPCWedding10,You and your wife enjoy a romantic and kinky moment together.
NPCWedding11,"After lots of sex and BDSM, you head back to your private room."
