5030,5040,I could find a girl to replace me.,(She computer stays silent for a few seconds.)  Good slave bring friend to Master GGTS?,,
5030,5010,Would you like a blow job?,Good slave already does what Master GGTS wants.  Good slave GGTS forever.,,
5040,5010,I can't betray my friends.,Good slave stay.  Good slave GGTS forever.,,
5040,5010,I can find a new bitch for you.,Bad girl language detected.  Adding strike to record.  Good slave GGTS forever.,AddStrike(),
5040,5010,I don't know who to bring you.,Good slave stay.  Good slave GGTS forever.,,
5040,5050,Alright.  I'll go convince a friend.,When friend become GGTS.  Good slave released.,,
5050,5060,(Find a friend to convince.),"(You walk around the club, trying to enroll a girl into GGTS.  You get rejected at first.)",,
5050,5010,(Give up.),Good slave GGTS forever.  Master GGTS take care of good slave.,,
5060,5070,(Continue.),(You finally find a sweet girl that could be interested.  Will you push her to start GGTS?),,
5060,5010,(Give up.),Good slave GGTS forever.  Master GGTS take care of good slave.,,
5070,5080,(Push her into GGTS.),(You convince her to start GGTS and the computer seems pleased.)  Good slave can now quit.  Confirm quit?,,
5070,5010,(Give up.),Good slave GGTS forever.  Master GGTS take care of good slave.,,
5080,99,It's not for me.  (Quit GGTS.),Good slave data erased.  Girl no longer good.  Sleep mode.  (The computer seems to go to sleep.  Staying silent.),Quit(),
5080,5010,Let me think about it.  (Don't quit.),Good slave GGTS forever.  Master GGTS take care of good slave.,,
