Stage,LoveReq,SubReq,VarReq,Interaction,Result,NextStage,LoveMod,SubMod,Function
0,0,0,HasInvitation,是的，这是。|(展示邀请函),(她核验邀请函)  很好。|你知道洋馆里的规则吗？,100,0,0,
0,0,0,HasInvitation,当然，女孩!|(展示邀请函),(她核验邀请函)  很好，女士。|你知道洋馆里的规则吗？,100,0,0,
0,0,0,HasInvitation,是的，小姐，对不起|(展示邀请函),(她核验邀请函)  好女孩。|你知道洋馆里的规则吗？,100,0,0,
0,0,0,WithSarah,不，我的朋友。|Sarah邀请了我。,(Sarah 似乎有些紧张)|是的，我邀请了她。,10,0,0,
0,0,0,WithSarah,我是跟她来的。|(转向Sarah.),(Sarah 似乎有些紧张)|是的，我邀请了她。,10,0,0,
10,0,0,,(Check the maid.),"Sarah, 你知道你不应该邀请陌生人。",20,0,0,
20,0,0,,(Check Sarah.),我知道，女士！ 但她是俱乐部的完美人选，相信我。,30,0,0,
30,0,0,,(Check the maid.),"年轻的小姐, 你今晚会受到惩罚。|进去吧。我会和你的朋友谈谈。",40,0,0,
40,0,0,,(Check Sarah.),惩罚!  这太不公平了。|稍后见 COMMON_PLAYERNAME.,50,0,0,SarahPunished()
50,0,0,,小心， Sarah!,(Sarah 离开了，然后女仆转向你)|我相信你想进来，小姐。,60,0,0,
50,0,0,,稍后见。,(Sarah 离开了，然后女仆转向你)|我相信你想进来，小姐。,60,0,0,
50,0,0,,Sarah!  等等!,(Sarah 离开了，然后女仆转向你)|我相信你想进来，小姐。,60,0,0,
60,0,0,,是的，女士。,好女孩。 既然你和Sarah谈过了。|你知道洋馆的规则吗？,100,0,0,
60,0,0,,我当然愿意。,好的。  既然你和Sarah谈过了。|你知道洋馆的规则吗？,100,0,0,
100,0,0,,我知道。现在|我能进去了吗？,你需要先回答这个问题。|你的思想开放、成熟吗?,110,0,0,
100,0,0,,我不记得了。,首先，这是一个成人BDSM俱乐部|你的思想开放、成熟吗?,110,0,0,
100,0,0,,不，我不知道规则。,首先，这是一个成人BDSM俱乐部|你的思想开放、成熟吗?,110,0,0,
110,0,0,,我是一个成年人，|并且我思想开放。,很好。 在俱乐部里，你会遇到很多来自|世界各地的人，你会对他们有礼貌吗？,120,0,0,
110,0,0,,我不是一个成年人。,此游戏仅供成年人。|请玩其他游戏。,199,0,0,
120,0,0,,我会彬彬有礼|并且尊重他人,"很好。在Bondage Club,你可以随心所欲的|成为任何你想成为的人。",130,0,0,
120,0,0,,我是个混蛋。,此游戏不适合您。|请玩其他游戏。,199,0,0,
130,0,0,,我可以修改我的|姓名和外观？,"Absolutely, 进入俱乐部这是必须的|你以前的生活在这里无关紧要。",140,0,0,
140,0,0,IsCollared,关于我的女主人？,在没有获得俱乐部女主人许可的情况下|你不能邀请你的女主人。,150,0,0,
140,0,0,!IsCollared,关于我的朋友？,在没有获得俱乐部女主人许可的情况下|你不能邀请你的朋友。,150,0,0,
140,0,0,!IsCollared,关于我的奴隶？,在没有获得俱乐部女主人许可的情况下|你不能邀请你的奴隶。,150,0,0,
150,0,0,,我明白。,你准备好进入俱乐部了吗？|我会领你去更衣室,160,0,0,
160,0,0,BeltProblem,(脸红)  我有一个|金属的内裤。,不要担心，女士。你不是唯一|一个穿着腰带的。你可以进来。,160,0,0,
160,0,0,,我准备好了!|(进入俱乐部),,160,0,0,EnterClub()
