Tag,Content
Orgasm,aaaaaaAAAAAAHHH!!! (Yuki ti tiskne|tváře zatímco prožívá ohromný orgasmus.)
StopPleasure,"(Odstrčí te.) Ne, to stačí!|Neumíš to, trvá ti to moc dlouho."
LickEgg,"(Sundá si kalhotky, chytne tě za vlasy a|přitáhne si tě.) Tohle bude trest za to vajíčko!"
LickSub,"(Sundá si kalhotky, chytne tě za vlasy a|přitáhne si tě.) Hezky se snaž, zvířátko!"
NoPullEgg,"(Zkoušíš se odtáhnout, ale popadně tě za vlasy.)|Dalas mi tam to vajíčko. Teď to doděláš!"
NoPullSub,"(Zkoušíš se odtáhnout, ale popadně tě za vlasy.)|Kam si myslíš, že jdeš, subinko?!"
