Stage,LoveReq,SubReq,VarReq,IntroText,Image
0,0,0,,Vítej na hodině umění.|Ty jsi nová studentka?,Jennifer.jpg
10,0,0,,"Já jsem Jennifer, ráda tě poznávám.",Jennifer.jpg
20,0,0,,"Výtvarka je fajn, ale já raději sportuju.",Jennifer.jpg
30,0,0,,Co bys ráda?,Jennifer.jpg
40,0,0,,"Tak mi řekni, co máš na mysli.",Jennifer.jpg
50,0,0,,Takže ty chceš vidět učitelku svlečenou?|(Potřebuješ lásku nebo submisi alespoň +2),Jennifer.jpg
60,0,0,,Připomeň jí „Zrození Venuše“ od Sandra Botticelliho.|Možná ji to přesvědčí aby se svlékla.,Jennifer.jpg
60,0,0,JuliaStrip,Fungovalo to! To je fakt boží.,Jennifer.jpg
70,0,0,,"Netušila jsem, že Julie je tak odvážná.",Jennifer.jpg
80,0,0,,Dvě modelky! To jsem nečekala.,Jennifer.jpg
80,0,0,Common_PlayerGagged,Proč máš roubík?,Jennifer.jpg
80,0,0,Common_PlayerRestrained,Necítíš se poníženě?,Jennifer.jpg
100,0,0,,"Na pózování se moc necítím.|(Na to, aby se svlékla potřebuješ submisi +1.)",JenniferPose.jpg
110,0,0,,"Na pózování se moc necítím.|(Na to, aby svlékla i prádlo potřebuješ submisi +2.)",JenniferUnderwear.jpg
120,0,0,,"To je dost ponižující.|(Abys ji mohla svázat, potřebuješ submisi +3.)",JenniferNaked.jpg
130,0,0,,"To je velmi ponižující.|(Nevypadá, že by si to užívala.)",JenniferRope.jpg
130,0,0,EggInside,Mohla bys prosím vyndat tu růžovou věc?|(Náhodně se zásluhou vajíčka otřásá.),JenniferRope.jpg
140,0,0,,"Mhu nugin hm!  (Nevypadá to,|že by se jí líbilo být svázaná před celou třídou.)",JenniferRopeBallGag.jpg
140,0,0,EggInside,"(Potí se a náhodně se kvůli vajíčku otřásá.|Nezdá se, že by se jí líbilo být přede všemi svázaná.)",JenniferRopeBallGag.jpg
150,0,0,,"Mhu nugin hm!  (Nevypadá to,|že by se jí líbilo být svázaná před celou třídou.)",JenniferRopeTapeGag.jpg
150,0,0,EggInside,"(Potí se a náhodně se kvůli vajíčku otřásá.|Nezdá se, že by se jí líbilo být přede všemi svázaná.)",JenniferRopeTapeGag.jpg
